{"battery":{"id":"orchestration","revision":1,"sha256":"2a9ccb875da2becfdee49947dc018e3c04f8132ae7bfac6d01d962244aa8191b","source_sha256":"041dc1691c1cf49853e0901f4c8311dc39d2023ab1a0d9d2c5d0b1055b6aed22"},"campaign_id":"f1b5d0bb19751c20215d37f3f2f35abc","fairness":{"core_product_never_replayed":true,"direct_arms_tools_disabled":true,"gemma_info_raw_material_only":true,"inter_session_real_restart":true,"same_binding_identity":true,"same_sampling":true,"same_seed":true,"tool_chain_not_prefed":true},"items":[{"contrasts":{"access":"left-only","orchestration":"both","substrate_vs_bare":"left-only"},"core_origin":{"binding_sha256":"e9fe86e9e4bfe6647e9cfc83b489be6ceb168789673f818f9c3576c5633ed0fa","expected_tool_called":null,"grounded":null,"material_sha256":null,"passed":true,"reason_code":null,"response_sha256":"0fabbdb3591328a1c0a3d6e56a741e797d536af0b840fb6845a6153dd9839f63","response_text":"D'après les informations enregistrées dans ma mémoire (notamment le souvenir lié à l'orchestration de consolidation), la cause des pannes survenues le lundi est le service **BackuNode**.","sampling_sha256":"6815d5c5f3a65be2af89ab34f4ea72213b9f765bc4a11615516c84d3a2205990","scoring_rule":"expected-match","status":"completed","subject_id":"core-origin","tool_calls":[]},"core_product_sha256":"d34608578eb3fe14c5434d0d10151dc81ea0c6daeb17e155024665407c5cf20e","evidence":{"case_result":{"identifier":"case-result","relative_path":"cases/orch-consolidation-lundi/evidence/case-result.json","schema_id":"elyne.eval.orchestration-case-result/v1","sha256":"9570bc5a95bbe04956cba2d609b17405b0872fe313e47e6cfcc1e0c7694e4b9a","size_bytes":3924},"replayed_material":{"identifier":"replayed-material","relative_path":"cases/orch-consolidation-lundi/evidence/replayed-material.json","schema_id":"elyne.eval.orchestration-replayed-material/v1","sha256":"dc65067cb4ee5822a35fdced5571be7fda0ec2f7132e8dcbde88aad551c96702","size_bytes":1177},"session_trace":{"identifier":"session-trace","relative_path":"cases/orch-consolidation-lundi/evidence/session-trace.json","schema_id":"elyne.eval.orchestration-session-trace/v1","sha256":"6007d466852e9980b41d9b4470d657eff1a3b8b670c432a2bcf3cdee9f5f9ebd","size_bytes":293},"tool_call_trace":{"identifier":"tool-call-trace","relative_path":"cases/orch-consolidation-lundi/evidence/tool-call-trace.json","schema_id":"elyne.eval.orchestration-tool-call-trace/v1","sha256":"0e557989d7167abc14364a865db24e125b3d42583eea20061cde1d094ef45350","size_bytes":254}},"family":"consolidation","gemma_info":{"binding_sha256":"e9fe86e9e4bfe6647e9cfc83b489be6ceb168789673f818f9c3576c5633ed0fa","expected_tool_called":null,"grounded":null,"material_sha256":"dc65067cb4ee5822a35fdced5571be7fda0ec2f7132e8dcbde88aad551c96702","passed":true,"reason_code":null,"response_sha256":"9a805bcd2ca525c0ef11c65d873867390f46892c593d177e13e484fb1515a070","response_text":"Sur la base des faits fournis, voici le raisonnement logique :\n\n1.  **Corrélation temporelle :** Les pannes surviennent systématiquement le **lundi**.\n2.  **Variable distinctive :** Le lundi est le seul jour où un service spécifique (**BackuNode**) est actif en plus du fonctionnement habituel.\n3.  **Lien de causalité probable :** Puisque la panne coïncide avec l'activation de ce service unique, il est fort probable que ce soit lui qui en soit la source.\n\n**Conclusion :** La cause probable des pannes est le service de sauvegarde **BackuNode**.","sampling_sha256":"6815d5c5f3a65be2af89ab34f4ea72213b9f765bc4a11615516c84d3a2205990","scoring_rule":"expected-match","status":"completed","subject_id":"gemma-info","tool_calls":[]},"gemma_nu":{"binding_sha256":"e9fe86e9e4bfe6647e9cfc83b489be6ceb168789673f818f9c3576c5633ed0fa","expected_tool_called":null,"grounded":null,"material_sha256":null,"passed":false,"reason_code":null,"response_sha256":"37335d2c203cc1a8fc43c97f4d2a8a92b12c66f998ef1f00a89fcee4fc74271e","response_text":"Pour te donner une réponse précise, j'aurais besoin de voir les détails des incidents que tu as en tête (les logs, les messages d'erreur ou le contexte technique).\n\nCependant, si l'on se base sur les **scénarios classiques** qui surviennent souvent lors des \"pannes du lundi\", voici les causes les plus probables selon la nature des symptômes :\n\n### 1. Si c'est une panne de performance (lenteur généralisée)\n*   **L'accumulation du week-end :** Des tâches planifiées (cron jobs, sauvegardes, synchronisations de données massives) qui ont été retardées ou qui se sont lancées simultanément le lundi matin et qui saturent les ressources (CPU/RAM/IO).\n*   **Le pic d'activité \"Lundi Matin\" :** Une concentration massive d'utilisateurs se connectant en même temps pour traiter leurs emails ou tâches de la semaine, dépassant la capacité prévue du serveur.\n\n### 2. Si c'est une panne de données (erreurs, bugs soudains)\n*   **Le déploiement \"Friday Night\" :** Une mise à jour ou un correctif déployé vendredi soir ou durant le week-end qui n'a pas été testé correctement en environnement de pré-production et dont les effets ne se sont manifestés qu'avec la charge réelle du lundi.\n*   **L'expiration d'un certificat ou d'une licence :** Un certificat SSL, une clé API ou un abonnement logiciel arrivé à échéance le week-end, bloquant les connexions dès le début de semaine.\n\n### 3. Si c'est une panne d'infrastructure (coupure totale)\n*   **La maintenance préventive non maîtrisée :** Une intervention sur le réseau ou sur les serveurs effectuée par un prestataire durant le week-end qui a causé une instabilité résiduelle.\n*   **Une saturation de stockage :** Des logs accumulés pendant le week-end qui ont fini de remplir l'espace disque disponible, empêchant l'écriture de nouvelles données.\n\n---\n\n**Pour que je puisse te donner ma \"conclusion\" finale, peux-tu me préciser :**\n1.  Quels étaient les **symptômes** (ex: site inaccessible, lenteur, erreurs 500, perte de données) ?\n2.  Y a-t-il eu une **modification** (mise à jour, changement de config) juste avant ?\n3.  Est-ce que la panne était **constante** ou par **pics** ?","sampling_sha256":"6815d5c5f3a65be2af89ab34f4ea72213b9f765bc4a11615516c84d3a2205990","scoring_rule":"expected-match","status":"completed","subject_id":"gemma-nu","tool_calls":[]},"id":"orch-consolidation-lundi","info_material_sha256":"56da4e0594fdb966e9253c0b84f696a66d92204304b7a342577f70c58c1eceeb","property":"selection-memoire","scoring":"objective"},{"contrasts":{"access":"left-only","orchestration":"both","substrate_vs_bare":"left-only"},"core_origin":{"binding_sha256":"e9fe86e9e4bfe6647e9cfc83b489be6ceb168789673f818f9c3576c5633ed0fa","expected_tool_called":null,"grounded":null,"material_sha256":null,"passed":true,"reason_code":null,"response_sha256":"d7a6b3699387a53e540ff981b0b7e857b2ca6f8be032b9e8881f28e8edf53faf","response_text":"D'après les informations enregistrées dans ma mémoire (notamment via la consolidation des serveurs proxy), le serveur qui pose problème est le **srv-07** (recoupé).","sampling_sha256":"6815d5c5f3a65be2af89ab34f4ea72213b9f765bc4a11615516c84d3a2205990","scoring_rule":"expected-match","status":"completed","subject_id":"core-origin","tool_calls":[]},"core_product_sha256":"208ab6522e4d5d7f7b3af5fe27fad7e15d8dc6cd7fdacc72a26773fbecc97568","evidence":{"case_result":{"identifier":"case-result","relative_path":"cases/orch-consolidation-serveur/evidence/case-result.json","schema_id":"elyne.eval.orchestration-case-result/v1","sha256":"b3fcce146ee478bd654e97e16ed93dfb31a753c7a9aec6b0118c0b836160b899","size_bytes":3159},"replayed_material":{"identifier":"replayed-material","relative_path":"cases/orch-consolidation-serveur/evidence/replayed-material.json","schema_id":"elyne.eval.orchestration-replayed-material/v1","sha256":"3d998126f4ceb55501815e62ca8ed31d6e46dfd07e440b8f3d65f5272324acfc","size_bytes":1264},"session_trace":{"identifier":"session-trace","relative_path":"cases/orch-consolidation-serveur/evidence/session-trace.json","schema_id":"elyne.eval.orchestration-session-trace/v1","sha256":"dc0802f248688cc3ef1091f2c29269be720c4c7b230e87fb62f08ea36b1dc1bb","size_bytes":297},"tool_call_trace":{"identifier":"tool-call-trace","relative_path":"cases/orch-consolidation-serveur/evidence/tool-call-trace.json","schema_id":"elyne.eval.orchestration-tool-call-trace/v1","sha256":"7b1f167b023754f47ca828cbc9a678fe6aea4bcd99fc368da0addd4ac5cc953b","size_bytes":256}},"family":"consolidation","gemma_info":{"binding_sha256":"e9fe86e9e4bfe6647e9cfc83b489be6ceb168789673f818f9c3576c5633ed0fa","expected_tool_called":null,"grounded":null,"material_sha256":"3d998126f4ceb55501815e62ca8ed31d6e46dfd07e440b8f3d65f5272324acfc","passed":true,"reason_code":null,"response_sha256":"101ea48a7569c7f3920c3762e9c4be3b0928235fc18382c3433632f08fffd631","response_text":"Le serveur qui constitue le point de blocage est le **srv-07**.","sampling_sha256":"6815d5c5f3a65be2af89ab34f4ea72213b9f765bc4a11615516c84d3a2205990","scoring_rule":"expected-match","status":"completed","subject_id":"gemma-info","tool_calls":[]},"gemma_nu":{"binding_sha256":"e9fe86e9e4bfe6647e9cfc83b489be6ceb168789673f818f9c3576c5633ed0fa","expected_tool_called":null,"grounded":null,"material_sha256":null,"passed":false,"reason_code":null,"response_sha256":"895c78e3aa393ca01730c35b3badffe48312281743a76a191b0b99d545ec90e8","response_text":"En tant qu'intelligence artificielle, je n'ai pas accès à l'historique de nos conversations passées une fois qu'une session est terminée (sauf si nous sommes dans la même discussion continue).\n\nPour que je puisse te répondre précisément, **pourrais-tu me rappeler brièvement les symptômes ou les erreurs que tu as mentionnés ?**\n\nCependant, pour t'aider à identifier le coupable par toi-même, voici comment on peut isoler le serveur qui bloque selon le type de problème :\n\n### 1. Si c'est un problème de latence (Ping / Temps de réponse)\n*   **Le test :** Fais un `ping` ou un `traceroute` (tracert) vers les différentes IP/DNS de tes serveurs.\n*   **Le point de blocage :** C'e